{
  "$schema": "../../../../schemas/supply-chain.schema.json",
  "schemaVersion": "1.0",
  "_": "EP-004 · licence / provenance / checksum ที่ตรวจซ้ำได้ · ตรวจด้วย: node ../../claude-setup/supply-chain.js --root . --file docs/evidence/supply-chain.json · สรุป licence ถูก derive ใหม่จาก SBOM ทุกครั้ง เขียนตัวเลขเองไม่ได้",
  "project": "react-fastapi-postgres-crud",
  "generatedAt": "2026-09-23T23:45:00.000Z",
  "sboms": [
    {
      "path": "evidence/sbom-backend.cdx.json",
      "sha256": "15a4cd07ac1bd7157e2d26c1bd935117a854e2728d19d9e3b16b8ed6c7d0d018"
    },
    {
      "path": "evidence/sbom-frontend.cdx.json",
      "sha256": "bbdaacb28c9b3111f8f4f6a7b13d46cfe2a823959f26bbe18d175d9d14f03832"
    }
  ],
  "licenses": {
    "policy": {
      "allowed": [
        "MIT",
        "ISC",
        "Apache-2.0",
        "BSD-2-Clause",
        "BSD-3-Clause"
      ],
      "note": "Permissive licences whose only obligation is attribution, which this project satisfies by shipping the SBOM. Everything else is reviewed individually below."
    },
    "summary": {
      "NONE": 30,
      "MIT": 136,
      "Apache-2.0": 13,
      "BSD-2-Clause": 6,
      "BSD-3-Clause": 2,
      "ISC": 10,
      "Python-2.0": 1,
      "CC-BY-4.0": 1
    },
    "reviewed": [
      {
        "license": "NONE",
        "components": 30,
        "decision": "accepted-risk",
        "exception": "REQ-201",
        "note": "The publisher declares no licence the SBOM tool could resolve. An unlicensed component is not permissively licensed — it is a component with no grant at all — so this is an unanswered obligation rather than a formatting problem."
      },
      {
        "license": "CC-BY-4.0",
        "components": 1,
        "decision": "allowed",
        "note": "A content licence on a data package rather than a code licence. Attribution is the only obligation and the package is redistributed unmodified."
      },
      {
        "license": "Python-2.0",
        "components": 1,
        "decision": "allowed",
        "note": "Permissive, attribution only. No copyleft obligation and no restriction on commercial use or distribution."
      }
    ]
  },
  "provenance": {
    "source": {
      "repository": "Khattiya01/buaflow",
      "commit": "0867902176e09cbc43159d5076723f39969c3faa",
      "ref": "main"
    },
    "builder": {
      "provider": "github-actions",
      "workflow": "react-fastapi-postgres-crud CI",
      "runId": 35765907597,
      "url": "https://github.com/Khattiya01/buaflow/actions/runs/35765907597"
    },
    "subjects": [
      {
        "path": "backend/requirements-lock.txt",
        "sha256": "885492589fa652349df6a3af3f73bb80c2ced1a247574763e3432123b6d97cf8"
      },
      {
        "path": "frontend/package-lock.json",
        "sha256": "3d1a65624251607341df5a33b55494097743f329c115c3065a52fb1dfe30eb5f"
      }
    ],
    "notPublished": [
      {
        "artifact": "the production container image",
        "reason": "The image is built by whoever deploys it, from the Dockerfile in this repository, and is never pushed to a registry, so there is no published digest for a consumer to compare against."
      }
    ]
  }
}
